{
    "$schema": "http://json-schema.org/draft-07/schema#",
    "definitions": {
        "ElementAssetConfig": {
            "allOf": [
                {
                    "properties": {
                        "version": {
                            "type": "string"
                        }
                    },
                    "type": "object"
                },
                {
                    "properties": {
                        "cdn": {
                            "description": "Use the default CDN (true), a custom HTTP(S) asset base URL, or local assets (false). Defaults to true for PyIDE and false for other elements.",
                            "type": [
                                "string",
                                "boolean"
                            ]
                        }
                    },
                    "type": "object"
                }
            ]
        },
        "Language": {
            "enum": [
                "de",
                "en",
                "es",
                "fr",
                "it",
                "nl",
                "pt"
            ],
            "type": "string"
        },
        "Link": {
            "anyOf": [
                {
                    "properties": {
                        "href": {
                            "type": "string"
                        },
                        "icon": {
                            "type": "string"
                        },
                        "label": {
                            "type": "string"
                        }
                    },
                    "required": [
                        "href",
                        "label"
                    ],
                    "type": "object"
                },
                {
                    "properties": {
                        "icon": {
                            "type": "string"
                        },
                        "label": {
                            "type": "string"
                        },
                        "links": {
                            "items": {
                                "$ref": "#/definitions/Link"
                            },
                            "type": "array"
                        }
                    },
                    "required": [
                        "label",
                        "links"
                    ],
                    "type": "object"
                }
            ]
        },
        "ProtectMode": {
            "description": "How protected content is stored in the built HTML.\n\n- \"encrypt\": AES-256-GCM, key derived from the password with PBKDF2. The\n  plaintext never leaves the build. Needs `crypto.subtle`, which browsers\n  only expose in secure contexts (https or localhost).\n- \"obfuscate\": the legacy behaviour — content and password both ship in the\n  page. Provides no protection, but works from `file://`.",
            "enum": [
                "encrypt",
                "obfuscate"
            ],
            "type": "string"
        }
    },
    "properties": {
        "allowDangerousHtml": {
            "type": "boolean"
        },
        "author": {
            "properties": {
                "name": {
                    "type": "string"
                },
                "url": {
                    "type": "string"
                }
            },
            "type": "object"
        },
        "basePath": {
            "type": "string"
        },
        "breadcrumb": {
            "anyOf": [
                {
                    "properties": {
                        "home": {
                            "type": "string"
                        },
                        "separator": {
                            "type": "string"
                        }
                    },
                    "type": "object"
                },
                {
                    "type": "boolean"
                }
            ]
        },
        "cloud": {
            "anyOf": [
                {
                    "properties": {
                        "id": {
                            "type": "string"
                        },
                        "url": {
                            "type": "string"
                        }
                    },
                    "required": [
                        "id",
                        "url"
                    ],
                    "type": "object"
                },
                {
                    "properties": {
                        "sameOrigin": {
                            "const": true,
                            "type": "boolean"
                        }
                    },
                    "required": [
                        "sameOrigin"
                    ],
                    "type": "object"
                }
            ],
            "description": "Hyperbook Cloud, for student logins and saving their work.\n\nA book hosted elsewhere names its address on the platform (`url`, e.g.\n\"https://physics.example.page\") and its address name there (`id`).\nBooks the platform hosts get `{ \"sameOrigin\": true }` when it builds\nthem; set it by hand only to test."
        },
        "colors": {
            "properties": {
                "brand": {
                    "format": "color-hex",
                    "type": "string"
                },
                "brandDark": {
                    "format": "color-hex",
                    "type": "string"
                },
                "brandText": {
                    "format": "color-hex",
                    "type": "string"
                },
                "inverted": {
                    "type": "boolean"
                }
            },
            "type": "object"
        },
        "description": {
            "type": "string"
        },
        "elements": {
            "properties": {
                "blockflow": {
                    "$ref": "#/definitions/ElementAssetConfig"
                },
                "bookmarks": {
                    "anyOf": [
                        {
                            "properties": {
                                "version": {
                                    "type": "string"
                                }
                            },
                            "type": "object"
                        },
                        {
                            "const": false,
                            "type": "boolean"
                        }
                    ]
                },
                "code": {
                    "allOf": [
                        {
                            "properties": {
                                "version": {
                                    "type": "string"
                                }
                            },
                            "type": "object"
                        },
                        {
                            "properties": {
                                "bypassInline": {
                                    "type": "boolean"
                                },
                                "showLineNumbers": {
                                    "type": "boolean"
                                },
                                "theme": {
                                    "anyOf": [
                                        {
                                            "properties": {
                                                "dark": {
                                                    "type": "string"
                                                },
                                                "light": {
                                                    "type": "string"
                                                }
                                            },
                                            "required": [
                                                "dark",
                                                "light"
                                            ],
                                            "type": "object"
                                        },
                                        {
                                            "type": "string"
                                        }
                                    ]
                                }
                            },
                            "type": "object"
                        }
                    ]
                },
                "emoji": {
                    "allOf": [
                        {
                            "properties": {
                                "version": {
                                    "type": "string"
                                }
                            },
                            "type": "object"
                        },
                        {
                            "properties": {
                                "style": {
                                    "description": "How emojis are rendered.\n- \"native\": Emojis are kept as text and drawn with the emoji font of\n  the reader's operating system (default).\n- \"twemoji\": Emojis are replaced with Twemoji images, so they look the\n  same on every platform.",
                                    "enum": [
                                        "native",
                                        "twemoji"
                                    ],
                                    "type": "string"
                                }
                            },
                            "type": "object"
                        }
                    ]
                },
                "excalidraw": {
                    "allOf": [
                        {
                            "properties": {
                                "version": {
                                    "type": "string"
                                }
                            },
                            "type": "object"
                        },
                        {
                            "properties": {
                                "cdn": {
                                    "description": "Use the default CDN (true), a custom HTTP(S) asset base URL, or local assets (false). Defaults to true for PyIDE and false for other elements.",
                                    "type": [
                                        "string",
                                        "boolean"
                                    ]
                                }
                            },
                            "type": "object"
                        },
                        {
                            "properties": {
                                "aspectRatio": {
                                    "type": "string"
                                },
                                "autoZoom": {
                                    "type": "boolean"
                                },
                                "center": {
                                    "type": "boolean"
                                },
                                "edit": {
                                    "type": "boolean"
                                }
                            },
                            "type": "object"
                        }
                    ]
                },
                "geogebra": {
                    "$ref": "#/definitions/ElementAssetConfig"
                },
                "kirimoto": {
                    "allOf": [
                        {
                            "properties": {
                                "version": {
                                    "type": "string"
                                }
                            },
                            "type": "object"
                        },
                        {
                            "properties": {
                                "height": {
                                    "type": "string"
                                },
                                "settings": {
                                    "type": "string"
                                }
                            },
                            "type": "object"
                        }
                    ]
                },
                "onlineide": {
                    "allOf": [
                        {
                            "properties": {
                                "version": {
                                    "type": "string"
                                }
                            },
                            "type": "object"
                        },
                        {
                            "properties": {
                                "cdn": {
                                    "description": "Use the default CDN (true), a custom HTTP(S) asset base URL, or local assets (false). Defaults to true for PyIDE and false for other elements.",
                                    "type": [
                                        "string",
                                        "boolean"
                                    ]
                                }
                            },
                            "type": "object"
                        },
                        {
                            "properties": {
                                "height": {
                                    "type": [
                                        "string",
                                        "number"
                                    ]
                                },
                                "outputWidth": {
                                    "type": "string"
                                }
                            },
                            "type": "object"
                        }
                    ]
                },
                "openscad": {
                    "$ref": "#/definitions/ElementAssetConfig"
                },
                "pyide": {
                    "$ref": "#/definitions/ElementAssetConfig"
                },
                "sqlide": {
                    "allOf": [
                        {
                            "properties": {
                                "version": {
                                    "type": "string"
                                }
                            },
                            "type": "object"
                        },
                        {
                            "properties": {
                                "cdn": {
                                    "description": "Use the default CDN (true), a custom HTTP(S) asset base URL, or local assets (false). Defaults to true for PyIDE and false for other elements.",
                                    "type": [
                                        "string",
                                        "boolean"
                                    ]
                                }
                            },
                            "type": "object"
                        },
                        {
                            "properties": {
                                "db": {
                                    "type": "string"
                                },
                                "height": {
                                    "type": [
                                        "string",
                                        "number"
                                    ]
                                }
                            },
                            "type": "object"
                        }
                    ]
                },
                "typst": {
                    "$ref": "#/definitions/ElementAssetConfig"
                }
            },
            "type": "object"
        },
        "font": {
            "type": "string"
        },
        "fonts": {
            "properties": {
                "body": {
                    "type": "string"
                },
                "code": {
                    "type": "string"
                },
                "heading": {
                    "type": "string"
                }
            },
            "type": "object"
        },
        "importExport": {
            "type": "boolean"
        },
        "language": {
            "$ref": "#/definitions/Language"
        },
        "license": {
            "type": "string"
        },
        "links": {
            "items": {
                "$ref": "#/definitions/Link"
            },
            "type": "array"
        },
        "llms": {
            "type": "boolean"
        },
        "logo": {
            "type": "string"
        },
        "name": {
            "type": "string"
        },
        "protect": {
            "description": "Password protection behaviour. Passwords themselves live in a separate\nregistry file so this one can stay committed.",
            "properties": {
                "iterations": {
                    "description": "PBKDF2 iterations. Defaults to 250000.",
                    "type": "number"
                },
                "mode": {
                    "$ref": "#/definitions/ProtectMode",
                    "description": "Defaults to \"encrypt\"."
                },
                "passwordsFile": {
                    "description": "Registry location, relative to the book root. Defaults to \"passwords.json\".",
                    "type": "string"
                }
            },
            "type": "object"
        },
        "qrcode": {
            "type": "boolean"
        },
        "repo": {
            "anyOf": [
                {
                    "properties": {
                        "label": {
                            "type": "string"
                        },
                        "url": {
                            "type": "string"
                        }
                    },
                    "required": [
                        "label",
                        "url"
                    ],
                    "type": "object"
                },
                {
                    "type": "string"
                }
            ]
        },
        "scripts": {
            "items": {
                "type": "string"
            },
            "type": "array"
        },
        "search": {
            "type": "boolean"
        },
        "styles": {
            "items": {
                "type": "string"
            },
            "type": "array"
        },
        "toc": {
            "type": "boolean"
        },
        "trailingSlash": {
            "type": "boolean"
        },
        "version": {
            "description": "Controls how the Hyperbook version is displayed.\n- \"text\": Shows version below the \"Powered by Hyperbook\" label.\n- \"tooltip\": Shows version on hover of the \"Powered by Hyperbook\" label.\n- \"console\": Outputs version as ASCII art in the browser console (default).",
            "enum": [
                "console",
                "text",
                "tooltip"
            ],
            "type": "string"
        }
    },
    "required": [
        "name"
    ],
    "type": "object"
}

