{
  "name": "Hyperbook Dokumenation",
  "version": "text",
  "qrcode": true,
  "breadcrumb": true,
  "llms": true,
  "importExport": true,
  "search": true,
  "description": "Dokumentation für Hyperbook erstellt mit Hyperbook",
  "author": {
    "name": "OpenPatch",
    "url": "https://openpatch.org"
  },
  "allowDangerousHtml": true,
  "links": [
    {
      "label": "Changelog",
      "href": "/changelog"
    },
    {
      "label": "Kontakt",
      "links": [
        {
          "label": "Mail",
          "icon": "📧",
          "href": "mailto:contact@openpatch.org"
        },
        {
          "label": "Twitter",
          "icon": "🐦",
          "href": "https://twitter.com/openpatchorg"
        },
        {
          "label": "Mastodon",
          "icon": "🐘",
          "href": "https://fosstodon.org/@openpatch"
        },
        {
          "label": "Matrix (Chat)",
          "icon": "👨‍💻",
          "href": "https://matrix.to/#/#hyperbook:matrix.org"
        }
      ]
    }
  ],
  "elements": {
    "blockflow": {
      "cdn": true
    },
    "code": {
      "showLineNumbers": true
    },
    "emoji": {
      "style": "twemoji"
    },
    "excalidraw": {
      "cdn": true
    },
    "geogebra": {
      "cdn": true
    },
    "onlineide": {
      "cdn": true
    },
    "openscad": {
      "cdn": true
    },
    "pyide": {
      "cdn": true
    },
    "sqlide": {
      "cdn": true
    },
    "typst": {
      "cdn": true
    }
  },
  "language": "de",
  "logo": "/logo.svg",
  "repo": "https://github.com/openpatch/hyperbook/edit/main/website/de"
}
