{
  "name": "Hyperbook Documentation",
  "description": "Documentation for Hyperbook created with Hyperbook",
  "author": {
    "name": "OpenPatch",
    "url": "https://openpatch.org"
  },
  "links": [
    {
      "label": "Contact",
      "links": [
        {
          "label": "Mail",
          "icon": "ğŸ“§",
          "href": "mailto:contact@openpatch.org"
        },
        {
          "label": "Twitter",
          "icon": "ğŸ¦",
          "href": "https://twitter.com/openpatchorg"
        },
        {
          "label": "Mastodon",
          "icon": "ğŸ˜",
          "href": "https://fosstodon.org/@openpatch"
        },
        {
          "label": "Matrix (Chat)",
          "icon": "ğŸ‘¨â€ğŸ’»",
          "href": "https://matrix.to/#/#hyperbook:matrix.org"
        }
      ]
    }
  ],
  "language": "en",
  "repo": "https://github.com/openpatch/hyperbook/edit/main/website/en"
}
